{
  "schema_version": "1.0.0",
  "rubric_id": "M01-RU-PROFESSORIAL-REVIEW-v1",
  "record_id": "M01-RU-CH07-OPENER-R001",
  "curriculum_id": "python-from-zero",
  "language": "ru",
  "unit": {
    "inventory_ref": "chapter:07:theory:index",
    "kind": "chapter_opener",
    "title": "Глубокое погружение в Turtle",
    "canonical_source_path": "scripts/build_chapter_07.py",
    "baseline_source_sha256": "64ce61b1374bd8d8e3ae1b6652c8ee6c35ec752547e99ed305d8be5792a43dc3",
    "reviewed_source_sha256": "64ce61b1374bd8d8e3ae1b6652c8ee6c35ec752547e99ed305d8be5792a43dc3",
    "review_surface_path": "site/chapters/glava-07/index.html",
    "review_surface_sha256": "5af615110f66dfd7aa14253832e6d0682076025ebb8c49990dc8720652b10ebb"
  },
  "review_context": {
    "baseline_commit": "213ba4d51b75837eee3d6fd5333910226284944a",
    "review_commit": "d86ab31ed73658c275f90850f631d074d2d0b131",
    "started_at": "2026-09-02T06:00:00+00:00",
    "completed_at": "2026-09-02T06:41:00+00:00",
    "python_version": "3.14.6"
  },
  "learning_outcomes": [
    {
      "id": "LO-01",
      "statement": "The learner can use colormode/pencolor/fillcolor, tracer/update batching, and circle() geometry (direction, extent, steps) to produce controlled, efficient Turtle drawings.",
      "assessment_evidence_refs": [
        "E-001",
        "E-002"
      ]
    },
    {
      "id": "LO-02",
      "statement": "The learner can create and manage multiple/cloned Turtle objects and correctly distinguish clear()/reset()/home(), and can debug a forgotten screen.update() call.",
      "assessment_evidence_refs": [
        "E-001",
        "E-004"
      ]
    }
  ],
  "reviewers": [
    {
      "reviewer_id": "ai-opus5-m01i04",
      "display_name": "Claude Opus 5 — M01-I04 Batch B assistant analyst",
      "reviewer_type": "ai_assistant",
      "roles": [
        "assistant_analyst"
      ],
      "attestation": "Read scripts/build_chapter_07.py in full (all lesson-builder functions), cross-checked every printed/claimed code result by executing the corresponding snippets under the project's own .venv (Python 3.14.6), ran every canonical notebook for this chapter via scripts/run_notebook.py, independently re-verified every grader's expected value, and confirmed the canonical source and review-surface sha256 values match the current committed state exactly.",
      "reviewed_at": "2026-09-02T06:41:00+00:00"
    }
  ],
  "criteria": [
    {
      "criterion_id": "SM01",
      "score": 4,
      "rationale": "No factual defects found; circle() direction/geometry, tracer()/update() semantics, and clear()/reset()/home() distinctions all verified against real rendered output and official turtle module semantics.",
      "evidence_refs": [
        "E-001",
        "E-002"
      ]
    },
    {
      "criterion_id": "SM02",
      "score": 4,
      "rationale": "All API usage (colormode, tracer, clone, shapesize) matches the Python 3.14 standard-library turtle module with no deprecated usage found.",
      "evidence_refs": [
        "E-002"
      ]
    },
    {
      "criterion_id": "SM03",
      "score": 4,
      "rationale": "'курс' terminology from Chapter 6 reused consistently; no new terminology issues.",
      "evidence_refs": [
        "E-001"
      ]
    },
    {
      "criterion_id": "SM05",
      "score": 4,
      "rationale": "The opener promises color modes, speed/tracer, circle geometry, text, multiple turtles, clone, clear/reset/home, and two mini-projects (clock, target); all delivered with no gap.",
      "evidence_refs": [
        "E-001"
      ]
    },
    {
      "criterion_id": "SM08",
      "score": 4,
      "rationale": "The clock mini-project's angle formula (90-hour*30) independently re-derived for hours 0/3/6/9/12 and confirmed correct against a standard analog clock face.",
      "evidence_refs": [
        "E-002"
      ]
    },
    {
      "criterion_id": "PD01",
      "score": 4,
      "rationale": "Concrete, checkable scope (a clock face, a target) rather than vague aspirations.",
      "evidence_refs": [
        "E-001"
      ]
    },
    {
      "criterion_id": "PD02",
      "score": 4,
      "rationale": "Assumes all of Chapter 6's Turtle basics; every new API surface (colormode, tracer/update, clone, shapesize) is introduced from scratch before use.",
      "evidence_refs": [
        "E-001"
      ]
    },
    {
      "criterion_id": "PD03",
      "score": 4,
      "rationale": "Correctly frames Chapter 7 as a 'deep dive' extending Chapter 6 rather than repeating it — confirmed accurate; no content overlap found.",
      "evidence_refs": [
        "E-001"
      ]
    },
    {
      "criterion_id": "PD05",
      "score": 4,
      "rationale": "23 sections chunked into clear sub-arcs (shapes/circles -> color/speed -> circle geometry -> text/objects -> clear/reset/home -> mini-projects -> debugging/formula/prediction).",
      "evidence_refs": [
        "E-001"
      ]
    },
    {
      "criterion_id": "PD10",
      "score": 4,
      "rationale": "07-23/07-24/07-25 provide genuine browser-gradeable consolidation (debugging reasoning, formula computation, method-behavior prediction) without requiring a live window.",
      "evidence_refs": [
        "E-001",
        "E-004"
      ]
    },
    {
      "criterion_id": "CO01",
      "score": 4,
      "rationale": "'курс' and Chapter 6's coordinate/heading model reused identically; no renaming or contradiction.",
      "evidence_refs": [
        "E-001"
      ]
    },
    {
      "criterion_id": "CO02",
      "score": 4,
      "rationale": "All internal cross-references and PAGES entries verified to resolve to real, populated sections.",
      "evidence_refs": [
        "E-003"
      ]
    },
    {
      "criterion_id": "CO03",
      "score": 4,
      "rationale": "07-13 explicitly formalizes 07-08's informal circle-direction observation rather than silently repeating it; 07-14 explicitly connects circle(steps=n) back to Chapter 6's 360/n formula.",
      "evidence_refs": [
        "E-001"
      ]
    },
    {
      "criterion_id": "CO05",
      "score": 4,
      "rationale": "Chapter number, title, and all 23 section identifiers match the PAGES navigation model and sidebar exactly.",
      "evidence_refs": [
        "E-003"
      ]
    }
  ],
  "findings": [],
  "evidence": [
    {
      "evidence_id": "E-001",
      "type": "source_inspection",
      "summary": "Read scripts/build_chapter_07.py in full (1960 lines, 23 lesson-builder functions plus opener) covering screen/turtle config, shapes without lines, arcs, text, color modes, pen/fill distinction, speed/tracer/update, circle geometry, text/objects, multiple/cloned turtles, clear/reset/home, and two mini-projects.",
      "locator": "scripts/build_chapter_07.py:1-1960",
      "result": "informational"
    },
    {
      "evidence_id": "E-002",
      "type": "code_execution",
      "summary": "All 22 canonical notebooks executed cleanly under xvfb-run via scripts/run_notebook.py; circle-direction, tracer/update, and clear/reset/home claims independently confirmed via real-rendered output.",
      "locator": "xvfb-run -a .venv/bin/python scripts/run_notebook.py notebooks/chapter-07/*.ipynb",
      "result": "pass"
    },
    {
      "evidence_id": "E-003",
      "type": "code_execution",
      "summary": "scripts/validate_chapter_07_outputs.py confirms all 39 real-rendered Turtle examples have non-empty PNG output.",
      "locator": "xvfb-run -a .venv/bin/python scripts/validate_chapter_07_outputs.py",
      "result": "pass"
    },
    {
      "evidence_id": "E-004",
      "type": "code_execution",
      "summary": "07-23/07-24/07-25's browser-gradeable tasks (tracer(0)-without-update()=0 updates; 360/steps for steps=3,4,8; clear/reset/home move-to-origin predictions) independently re-derived and confirmed to match both theory pages and automated graders exactly.",
      "locator": ".venv/bin/python3 (interactive verification, this session)",
      "result": "pass"
    }
  ],
  "decision": {
    "status": "reviewed",
    "rationale": "Full canonical source read end to end, all 22 notebooks executed and all real-rendered Turtle output validated, all three automated-grader tasks independently re-derived and confirmed; no blocker/major/minor findings; ready for the human subject_matter_reviewer, methodology_reviewer, and final_approver gate required before APPROVED.",
    "decided_by": "ai-opus5-m01i04",
    "decided_at": "2026-09-02T06:41:00+00:00"
  },
  "status_history": [
    {
      "from": "not_started",
      "to": "in_review",
      "changed_by": "ai-opus5-m01i04",
      "changed_at": "2026-09-02T06:00:00+00:00",
      "reason": "M01-I04 Batch B opened formal review of this unit against the binding M01 rubric."
    },
    {
      "from": "in_review",
      "to": "reviewed",
      "changed_by": "ai-opus5-m01i04",
      "changed_at": "2026-09-02T06:41:00+00:00",
      "reason": "Full-chapter read, execution-based verification, and grader re-verification complete; all 14 applicable chapter_opener criteria scored with unit-specific evidence."
    }
  ]
}
